{"$schema":"https://json-schema.org/draft/2020-12/schema","$id":"https://universalos.dev/specs/bootstrap-adapter/manifest-v1.json","title":"UniversalOS bootstrap adapter manifest v1","type":"object","additionalProperties":false,"required":["schema_version","adapter_id","match","transport","recovery"],"properties":{"schema_version":{"const":1},"adapter_id":{"type":"string","pattern":"^uos\\.adapter\\.[a-z0-9][a-z0-9._-]*$"},"match":{"type":"object","additionalProperties":false,"required":["product_ids","architecture","board_family","soc_family","partition_model"],"properties":{"product_ids":{"type":"array","minItems":1,"uniqueItems":true,"items":{"type":"string","pattern":"^[a-z0-9][a-z0-9._-]*$"}},"architecture":{"enum":["arm64","armv7","x86_64","riscv64"]},"board_family":{"type":"string"},"soc_family":{"type":"string"},"partition_model":{"enum":["ab","transactional","single-slot"]}}},"transport":{"enum":["fastboot","recovery","adb"]},"recovery":{"type":"object","additionalProperties":false,"required":["offline_path_required","factory_restore_documented"],"properties":{"offline_path_required":{"const":true},"factory_restore_documented":{"type":"boolean"}}}}}
